{"entries":[{"id":"lynewright.integration.example-native","kind":"package","licence":"Apache-2.0","limits":{"cpus":1,"memory_mb":256,"pids":64,"timeout_seconds":60},"lynewright_version":"^0.1.0","permissions":{"capabilities":["media:create"],"credential_refs":[],"egress":"none","media":"write"},"review":{"catalogue_commit":"703e42c83d01dc96f7b967ff1f205a59c71cb53f","date":"2026-10-16","reviewer":"Lynewright maintainers"},"sha256":"d005f2f22ef850aab2c264ae991cdc9800adbfaa862ca252b454d93c3c6a0e06","source":"https://catalogue.example.invalid/artifacts/lynewright_integration_example-1.0.0-py3-none-any.whl","version":"1.0.0"},{"id":"lynewright.integration.template-mcp","kind":"file","licence":"Apache-2.0","lynewright_version":"^0.1.0","permissions":{"capabilities":["network:use"],"credential_refs":[],"egress":"none","media":"none"},"review":{"catalogue_commit":"703e42c83d01dc96f7b967ff1f205a59c71cb53f","date":"2026-10-16","reviewer":"Lynewright maintainers"},"sha256":"a6f16b8c76ac0decab3e8c284d2b9dc0d841a47c83722db2c98f43957ecdc0e5","source":"https://catalogue.example.invalid/artifacts/lynewright.integration.template-mcp-1.0.0.yaml","version":"1.0.0"},{"id":"lynewright.integration.template-openapi","kind":"file","licence":"Apache-2.0","lynewright_version":"^0.1.0","permissions":{"capabilities":["network:use"],"credential_refs":[],"egress":"none","media":"none"},"review":{"catalogue_commit":"703e42c83d01dc96f7b967ff1f205a59c71cb53f","date":"2026-10-16","reviewer":"Lynewright maintainers"},"sha256":"83981a6031b9b7001c934b3c7cc929307bbb6432c21a808665c65f6360135c02","source":"https://catalogue.example.invalid/artifacts/lynewright.integration.template-openapi-1.0.0.yaml","version":"1.0.0"}],"format":"lynewright-catalogue/1","generated_at":"2026-10-16T00:00:00Z","name":"Lynewright Community Integration Catalogue","serial":1}