{"entries":[{"description":"For Python code you trust, this starter declares a setting, an asynchronous operation, and a managed image output. Its declaration is packaged as lynewright-manifest.json and read by the API without importing the package; unless trusted in-process execution is enabled, provider code loads in the runner. Its tests keep the package invisible while unlisted, then allowlist it and run its async operation through a production line.","id":"lynewright.integration.example-native","kind":"package","licence":"Apache-2.0","limits":{"cpus":1,"memory_mb":256,"pids":64,"timeout_seconds":60},"lynewright_version":"^0.1.0","name":"Native Python Example","permissions":{"capabilities":["media:create"],"credential_refs":[],"egress":"none","media":"write"},"review":{"catalogue_commit":"703e42c83d01dc96f7b967ff1f205a59c71cb53f","date":"2026-10-16","reviewer":"Lynewright maintainers"},"sha256":"d005f2f22ef850aab2c264ae991cdc9800adbfaa862ca252b454d93c3c6a0e06","source":"https://catalogue.example.invalid/artifacts/lynewright_integration_example-1.0.0-py3-none-any.whl","summary":"A trusted-code starter with an async operation and managed image output.","version":"1.0.0"},{"description":"This starter exposes one read-only echo tool over Streamable HTTP. Its test starts the local MCP server, imports the declaration, discovers and approves the tool, maps it to the testkit contract, then runs it through a production line. Replace the example tool and integration declaration while keeping approval explicit.","id":"lynewright.integration.template-mcp","kind":"file","licence":"Apache-2.0","lynewright_version":"^0.1.0","name":"MCP Example","permissions":{"capabilities":["network:use"],"credential_refs":[],"egress":"none","media":"none"},"requires_operator_setup":["Start the MCP example service, map it with LYNEWRIGHT_INTERNAL_ENDPOINT__<REF>, and enter <REF> when installing."],"review":{"catalogue_commit":"703e42c83d01dc96f7b967ff1f205a59c71cb53f","date":"2026-10-16","reviewer":"Lynewright maintainers"},"sha256":"a6f16b8c76ac0decab3e8c284d2b9dc0d841a47c83722db2c98f43957ecdc0e5","source":"https://catalogue.example.invalid/artifacts/lynewright.integration.template-mcp-1.0.0.yaml","summary":"A read-only echo tool over Streamable HTTP.","version":"1.0.0"},{"description":"This starter provides a synchronous health check and an asynchronous job endpoint. Its tests start a local FastAPI service and run both operations through a production line with lynewright-testkit; the first job poll is pending and the next is done. Replace the example routes, schemas, and operation IDs with your service contract.","id":"lynewright.integration.template-openapi","kind":"file","licence":"Apache-2.0","lynewright_version":"^0.1.0","name":"OpenAPI Example","permissions":{"capabilities":["network:use"],"credential_refs":[],"egress":"none","media":"none"},"requires_operator_setup":["Start the OpenAPI example service, map it with LYNEWRIGHT_INTERNAL_ENDPOINT__<REF>, and enter <REF> when installing."],"review":{"catalogue_commit":"703e42c83d01dc96f7b967ff1f205a59c71cb53f","date":"2026-10-16","reviewer":"Lynewright maintainers"},"sha256":"83981a6031b9b7001c934b3c7cc929307bbb6432c21a808665c65f6360135c02","source":"https://catalogue.example.invalid/artifacts/lynewright.integration.template-openapi-1.0.0.yaml","summary":"A health check and asynchronous job API.","version":"1.0.0"}],"format":"lynewright-catalogue/1","generated_at":"2026-10-16T22:36:55Z","name":"Lynewright Community Integration Catalogue","serial":4}